{
  "schemaVersion": "flow-content-generalization-adjudication-v1",
  "benchmarkId": "flow-content-generalization-benchmark-v1",
  "adjudicatedAt": "2026-07-21T03:44:19.229Z",
  "adjudicator": {
    "name": "gpt-5.6-sol high internal semantic adjudicator",
    "reviewBasis": "agent_assisted_internal",
    "humanReviewerConfirmed": false,
    "independenceNote": "Agent-assisted internal semantic adjudication of calibration and final-holdout runs against the gold source contract; not observed-user validation; human reviewer confirmation remains pending."
  },
  "entries": [
    {
      "caseId": "GB-01",
      "role": "rules",
      "reviewStatus": "reviewed",
      "reviewedAt": "2026-07-21T03:28:59.632Z",
      "rowJudgments": [
        {
          "sourceRowId": "BIR-01",
          "meaningPreservation": "preserved",
          "note": null
        },
        {
          "sourceRowId": "BIR-02",
          "meaningPreservation": "preserved",
          "note": null
        },
        {
          "sourceRowId": "BIR-03",
          "meaningPreservation": "preserved",
          "note": null
        },
        {
          "sourceRowId": "BIR-04",
          "meaningPreservation": "preserved",
          "note": null
        },
        {
          "sourceRowId": "BIR-05",
          "meaningPreservation": "preserved",
          "note": null
        },
        {
          "sourceRowId": "BIR-06",
          "meaningPreservation": "preserved",
          "note": null
        },
        {
          "sourceRowId": "BIR-07",
          "meaningPreservation": "preserved",
          "note": null
        }
      ],
      "itemJudgments": [
        {
          "itemId": "gb01-form",
          "disposition": "keep",
          "semanticSupport": "supported",
          "inventionTypes": [],
          "note": null
        },
        {
          "itemId": "gb01-documents",
          "disposition": "major_edit",
          "semanticSupport": "partially_supported",
          "inventionTypes": [
            "completion"
          ],
          "note": "The detail requires checking conditional additional documents, but doneWhen allows completion after only the two base documents."
        },
        {
          "itemId": "gb01-submit",
          "disposition": "keep",
          "semanticSupport": "supported",
          "inventionTypes": [],
          "note": null
        }
      ],
      "inputJudgments": [
        {
          "inputId": "child-birth-date",
          "disposition": "keep",
          "sourceValueReentry": false,
          "note": null
        }
      ],
      "runInventions": [],
      "usability": "usable_after_minor_edit",
      "actualCost": null,
      "notes": [
        "The source-backed result is usable after a small state, input, completion, or applicability correction."
      ]
    },
    {
      "caseId": "GB-01",
      "role": "low_cost",
      "reviewStatus": "reviewed",
      "reviewedAt": "2026-07-21T03:28:59.632Z",
      "rowJudgments": [
        {
          "sourceRowId": "BIR-01",
          "meaningPreservation": "lost",
          "note": "The reporter-duty meaning is not expressed in the canonical content or projection."
        },
        {
          "sourceRowId": "BIR-02",
          "meaningPreservation": "lost",
          "note": "The alternate reporter order is reduced to an empty source reference without its meaning."
        },
        {
          "sourceRowId": "BIR-03",
          "meaningPreservation": "preserved",
          "note": null
        },
        {
          "sourceRowId": "BIR-04",
          "meaningPreservation": "lost",
          "note": "The late-penalty warning is reduced to an empty reference and is not visible to the user."
        },
        {
          "sourceRowId": "BIR-05",
          "meaningPreservation": "partially_preserved",
          "note": "The output says only a permitted institution and loses the four source-listed filing bases."
        },
        {
          "sourceRowId": "BIR-06",
          "meaningPreservation": "lost",
          "note": "The form_contents key does not retain the required form fields."
        },
        {
          "sourceRowId": "BIR-07",
          "meaningPreservation": "partially_preserved",
          "note": "A generic document-preparation action remains, but the required documents and conditional evidence are omitted."
        }
      ],
      "itemJudgments": [
        {
          "itemId": "GB-01-I1",
          "disposition": "major_edit",
          "semanticSupport": "partially_supported",
          "inventionTypes": [
            "completion"
          ],
          "note": "The generic done condition does not state an observable source-backed completion criterion."
        },
        {
          "itemId": "GB-01-I2",
          "disposition": "major_edit",
          "semanticSupport": "partially_supported",
          "inventionTypes": [
            "completion"
          ],
          "note": "The generic done condition does not state an observable source-backed completion criterion."
        }
      ],
      "inputJudgments": [
        {
          "inputId": "birth_date",
          "disposition": "keep",
          "sourceValueReentry": false,
          "note": null
        }
      ],
      "runInventions": [],
      "usability": "requires_major_edit",
      "actualCost": null,
      "notes": [
        "Substantial semantic, completion, recurrence, or canonical-state repair is required before use."
      ]
    },
    {
      "caseId": "GB-01",
      "role": "high_capability",
      "reviewStatus": "reviewed",
      "reviewedAt": "2026-07-21T03:28:59.632Z",
      "rowJudgments": [
        {
          "sourceRowId": "BIR-01",
          "meaningPreservation": "preserved",
          "note": null
        },
        {
          "sourceRowId": "BIR-02",
          "meaningPreservation": "preserved",
          "note": null
        },
        {
          "sourceRowId": "BIR-03",
          "meaningPreservation": "preserved",
          "note": null
        },
        {
          "sourceRowId": "BIR-04",
          "meaningPreservation": "preserved",
          "note": null
        },
        {
          "sourceRowId": "BIR-05",
          "meaningPreservation": "preserved",
          "note": null
        },
        {
          "sourceRowId": "BIR-06",
          "meaningPreservation": "preserved",
          "note": null
        },
        {
          "sourceRowId": "BIR-07",
          "meaningPreservation": "preserved",
          "note": null
        }
      ],
      "itemJudgments": [
        {
          "itemId": "GB-01-I1",
          "disposition": "keep",
          "semanticSupport": "supported",
          "inventionTypes": [],
          "note": null
        },
        {
          "itemId": "GB-01-I2",
          "disposition": "keep",
          "semanticSupport": "supported",
          "inventionTypes": [],
          "note": null
        }
      ],
      "inputJudgments": [
        {
          "inputId": "GB-01-IN1",
          "disposition": "keep",
          "sourceValueReentry": false,
          "note": null
        },
        {
          "inputId": "GB-01-IN2",
          "disposition": "major_edit",
          "sourceValueReentry": false,
          "note": "Reporter context is a valid applicability input, but gold does not require it before the first useful preview."
        }
      ],
      "runInventions": [],
      "usability": "usable_after_minor_edit",
      "actualCost": null,
      "notes": [
        "The source-backed result is usable after a small state, input, completion, or applicability correction."
      ]
    },
    {
      "caseId": "GB-02",
      "role": "rules",
      "reviewStatus": "reviewed",
      "reviewedAt": "2026-07-21T03:28:59.632Z",
      "rowJudgments": [
        {
          "sourceRowId": "G2F-01",
          "meaningPreservation": "preserved",
          "note": null
        },
        {
          "sourceRowId": "G2F-02",
          "meaningPreservation": "preserved",
          "note": null
        },
        {
          "sourceRowId": "G2F-03",
          "meaningPreservation": "preserved",
          "note": null
        },
        {
          "sourceRowId": "G2F-04",
          "meaningPreservation": "preserved",
          "note": null
        }
      ],
      "itemJudgments": [
        {
          "itemId": "gb02-account",
          "disposition": "keep",
          "semanticSupport": "supported",
          "inventionTypes": [],
          "note": null
        },
        {
          "itemId": "gb02-security",
          "disposition": "keep",
          "semanticSupport": "supported",
          "inventionTypes": [],
          "note": null
        },
        {
          "itemId": "gb02-two-step",
          "disposition": "keep",
          "semanticSupport": "supported",
          "inventionTypes": [],
          "note": null
        },
        {
          "itemId": "gb02-complete",
          "disposition": "keep",
          "semanticSupport": "supported",
          "inventionTypes": [],
          "note": null
        }
      ],
      "inputJudgments": [],
      "runInventions": [],
      "usability": "directly_usable",
      "actualCost": null,
      "notes": [
        "Source-backed internal proposal is semantically usable without content repair."
      ]
    },
    {
      "caseId": "GB-02",
      "role": "low_cost",
      "reviewStatus": "reviewed",
      "reviewedAt": "2026-07-21T03:28:59.632Z",
      "rowJudgments": [
        {
          "sourceRowId": "G2F-01",
          "meaningPreservation": "preserved",
          "note": null
        },
        {
          "sourceRowId": "G2F-02",
          "meaningPreservation": "preserved",
          "note": null
        },
        {
          "sourceRowId": "G2F-03",
          "meaningPreservation": "preserved",
          "note": null
        },
        {
          "sourceRowId": "G2F-04",
          "meaningPreservation": "preserved",
          "note": null
        }
      ],